{
  "authority_status": "repair_ready_not_submitted",
  "bindings": [
    {
      "path": "research/paper2_microtrial_v3/CPU_STAGING_ASSET_MANIFEST_V3.json",
      "role": "asset_manifest",
      "sha256": "8c24f0bcdb45357ea79c3d8cfe4c0d73d2741df5b64348a860f776b7e9480b7c"
    },
    {
      "path": "research/paper2_microtrial_v3/CP311_LINUX_X86_64_WHEEL_LOCK_AUDIT.json",
      "role": "wheel_lock",
      "sha256": "e06c27464d15b46617b1b8c8f79544f6173267b080189257b2d0e28d006afff3"
    },
    {
      "path": "research/paper2_microtrial_v3/requirements-cp311-linux-x86_64-v3.lock",
      "role": "requirements_lock",
      "sha256": "291752036b264369795967b2599ca401a1707750a213b0992c2ef4a3b55c87b0"
    },
    {
      "path": "experiments/paper2/lunarc/network_probe_v3_1.sbatch",
      "role": "network_probe_batch",
      "sha256": "08ad1313b072caca7c934b6f7112800783807d67fa9d05f2b51c1f9877b96541"
    },
    {
      "path": "experiments/paper2/lunarc/stage_cpu_assets_v3_1.sbatch",
      "role": "staging_batch",
      "sha256": "b0eadfa78475c75b6056b9a28e9279a26899aa17625261cc35dbedec1f30072f"
    },
    {
      "path": "experiments/paper2/lunarc/bootstrap_repo_v3.sh",
      "role": "repo_bootstrap_script",
      "sha256": "191fcaa24ea3aa246f7d763a2d1f679f308de18ae43f903fe0833f63aac29ce7"
    },
    {
      "path": "experiments/paper2/lunarc/submit_cpu_staging_v3_1.sh",
      "role": "submission_script",
      "sha256": "6db1a92a24856063593a6ec19395a18b902f0282f89b7361ff38708045b8319d"
    },
    {
      "path": "experiments/paper2/lunarc/harvest_cpu_staging_v3_1.sh",
      "role": "harvest_script",
      "sha256": "9cef9a6da4df060aaf90f51ec1172925d6b95b2b7ca9f10586703ce3e35dea0a"
    },
    {
      "path": "src/rakl/paper2_cpu_staging_v3_1.py",
      "role": "staging_runtime",
      "sha256": "0685ed7492a84a6075d41c15e7b355066c055952586f7d73ba08b2c656eda4c2"
    },
    {
      "path": "schemas/paper2-cpu-staging-contract-v3-1.schema.json",
      "role": "contract_schema",
      "sha256": "cc5f2012b2d04d992a1f3b986a57115c0b26db1b19982a41a4702923f7656979"
    },
    {
      "path": "schemas/paper2-cpu-staging-construction-receipt-v3-1.schema.json",
      "role": "construction_receipt_schema",
      "sha256": "295876786516ddc3189e5412cd0b0f58f41d416ba7646b3e39c01fad707a8a78"
    },
    {
      "path": "schemas/paper2-cpu-staging-submission-receipt-v3-1.schema.json",
      "role": "submission_receipt_schema",
      "sha256": "125fdc57abe28a6146a3eab2e8cd8fd747d5de7471a3aeefe975214541dd3939"
    },
    {
      "path": "schemas/paper2-cpu-staging-network-probe-receipt-v3-1.schema.json",
      "role": "network_probe_receipt_schema",
      "sha256": "23b8a23c8f70dc34ac3c6043edc9703ec83b4b281025535d5178c03eaf4bbf5d"
    },
    {
      "path": "schemas/paper2-cpu-staging-result-receipt-v3-1.schema.json",
      "role": "result_receipt_schema",
      "sha256": "f709884864ef6ea2d9d36a006c2e0f508416dc5bce5b2311a3ec3e3c11af6a38"
    },
    {
      "path": "schemas/paper2-cpu-staging-harvest-receipt-v3-1.schema.json",
      "role": "harvest_receipt_schema",
      "sha256": "7b711662f9f850fb9f3ffbe10052b98b9641d61b886226f7314d0f8e213ba68b"
    },
    {
      "path": "research/paper2_microtrial_v3/CPU_STAGING_CONTRACT_V3_1.json",
      "role": "contract_self",
      "sha256": "a90457ed4e241dc6d970f2332c532d49b14d4dd99146167a4dd5ca8cf1610cd1",
      "sha256_mode": "canonical_contract_with_self_sha256_zeroed"
    }
  ],
  "bootstrap_policy": {
    "atomic_candidate_promotion_required": true,
    "clean_tree_required": true,
    "detached_checkout_required": true,
    "exact_origin_url_required": true,
    "exact_repo_sha_required": true,
    "existing_repo_never_silently_mutated": true,
    "successful_bootstrap_receipt_required_before_submission": true
  },
  "candidate_root": "/projects/hep/fs9/users/scyiu/RAKL-paper2/assets/.paper2-cpu-v3-1-candidate",
  "claim_boundary": "V3.1 is a downloader repair packet only. It authorizes no model execution and contains no evaluated result. Its default operator state is READY_NOT_SUBMITTED; a retry requires a new explicit operator action after merge and exact-checkout bootstrap.",
  "construction_parent_sha": "1a9d3079571e1f1278e32061665be885845bd5cf",
  "contract_id": "PAPER2_CPU_STAGING_V3_1",
  "created_at_utc": "2026-08-11T00:42:53Z",
  "failure_policy": {
    "never_reuse_existing_candidate_or_final": true,
    "partial_submission_job_id_must_be_receipted": true,
    "preserve_failed_candidate_and_receipt": true,
    "preserve_v3_failure_lineage": true
  },
  "failure_root": "/projects/hep/fs9/users/scyiu/RAKL-paper2/failures/v3_1",
  "final_root": "/projects/hep/fs9/users/scyiu/RAKL-paper2/assets/paper2-cpu-v3-1",
  "fs9_root": "/projects/hep/fs9/users/scyiu/RAKL-paper2",
  "model_execution_permitted": false,
  "predecessor_failure": {
    "contract_id": "PAPER2_CPU_STAGING_V3",
    "first_missing_artifact": "wheel:torch==2.8.0+cpu",
    "http_status": 403,
    "localization_authority": "bounded_inference_from_first_missing_manifest_artifact_not_direct_failure-receipt_proof",
    "preserved_candidate_path": "/projects/hep/fs9/users/scyiu/RAKL-paper2/assets/.paper2-cpu-v3-candidate-3475081",
    "probe_job_id": "3475080",
    "staging_job_id": "3475081",
    "staging_verdict": "STAGING_FAILED_PRESERVED"
  },
  "promotion_policy": {
    "all_artifacts_hash_and_size_verified_before_promotion": true,
    "atomic_rename_required": true,
    "final_must_not_exist": true,
    "installed_version_equality_required": true,
    "offline_hash_locked_install_required": true,
    "same_filesystem_candidate_and_final_required": true
  },
  "receipt_root": "/projects/hep/fs9/users/scyiu/RAKL-paper2/receipts/v3_1",
  "repair_boundary": "The V3 HTTP 403 failure and candidate are preserved. V3.1 changes GET request identity and adds artifact/status receipts; it does not retroactively change V3 or claim staging success.",
  "schema_version": "paper2-cpu-staging-contract-v3.1",
  "staging_attestation_policy": {
    "construction_parent_ancestor_required": true,
    "full_distribution_set_equality_required": true,
    "minimum_free_bytes": 6000000000,
    "pip_check_required": true,
    "pip_freeze_all_required": true,
    "platform_architecture": "x86_64",
    "repository_tree_sha_required": true,
    "tensor_device": "cpu",
    "torch_cuda_must_be_null": true,
    "torch_version": "2.8.0+cpu"
  },
  "submission_policy": {
    "clean_checkout_required": true,
    "default_operator_mode": "READY_NOT_SUBMITTED",
    "exact_repo_sha_required": true,
    "lunarc_login_host_required": true,
    "network_probe_must_precede_staging": true,
    "observed_account_partition_association_required": true,
    "retry_requires_new_explicit_operator_action": true
  },
  "supersedes_contract_id": "PAPER2_CPU_STAGING_V3"
}
